,ID,年齢,性別,都道府県,年収(下限),年収(上限),学歴,大学,学部,卒業,英語,DS経験年数,コアスキル
71,BU1458792,46,男性,神奈川県,600,750,大学卒,駒澤大学,文学部社会学科心理学コース ,2000年3月,なし,0,顧客分析（デシル分析、RFM、クラスター分析など）、施策のレスポンス予測等の各種予測分析、商品レコメンド、需要予測、テキストマイニング 、センサーデータ解析（異常検知、周波数解析）、ディープラーニング（画像認識）#IBM SPSS Modeler、R、SQL、Python、Keras（TensorFlow）、SAS、Tableau、QlickView、NYSOL、TrueTeller#PostgreSQL、MySQL、Amazon Redshift、DB2 BLU、Teradata Aster、Greenplum（MADLib）、SQL Server、Oracle、Sybase#PHP、HTML，JavaScript、Perl、C++、VC++、VB.NET、ASP.NET
72,BU1570438,33,男性,宮城県,600,750,大学院卒（博士）,東北大学大学院,理学研究科数学専攻 ,2018年3月,日常会話レベル,2,Python#SQL#環境構築#データエンジニアリング#データサイエンス
73,BU2328843,45,男性,東京都,1000,1250,大学卒,国立大学法人,岩手大学 ,2000年3月,なし,0,ＢtoＢ#行動ターゲティング#データマイニング
74,BU1216038,32,男性,東京都,1000,1250,大学卒,University,of ,2014年12月,ビジネス会話レベル,0,機械学習#python#javascript#ruby#React#英語：ビジネスレベル#Vue.js
75,BU0586013,40,女性,東京都,500,500,大学卒,獨協大学,外国語学部 ,2006年3月,日常会話レベル,0,SQL・HQL#DBの導入・開発・運用までの一通りの知識と経験#データ分析#Excel・Access VBA
76,BU3229390,34,男性,東京都,1250,1500,大学院卒（修士）,東京大学,情報理工学系研究科 ,2014年3月,日常会話レベル,0,スクラム手法を中心としたアジャイルなプロジェクト運用#幅広い技術知識による少人数でのプロジェクト立ち上げ#Webサーバーのバックエンドの開発経験#rustやc++などのモダンなプログラミング言語を利用した効率的な組込み開発#枯れた機械学習技術の素早いPoC適用
77,BU1862998,28,男性,兵庫県,500,500,大学卒,大阪府立大学,,,日常会話レベル,2,Python#画像処理エンジニア検定エキスパート#プロジェクトマネジメント
78,BU2275531,33,男性,東京都,750,1000,大学院卒（修士）,マンチェスター大学,国際開発学部 ,,ビジネス会話レベル,0,SQL#動的リマーケティング広告#リスティング広告#ブランディング広告#デジタルマーケティング#アフィリエイト広告#インフルエンサーマーケティング#メディア、代理店と協力して外部広告を利用した流入戦略#消費者の購買分析#LTV分析#英語を活かした海外のステークホルダーとの連携
79,BU0390678,40,男性,東京都,600,750,その他,東京大学大学院（単位取得退学）,経済学研究科 ,2013年3月,ビジネス会話レベル,9,ミクロ経済学#データ分析#データ関連ソフトウェアの導入と実装#機械学習#人工知能#マーケットデザイン#論理的思考#ゲーム理論#ダイナミック・プライシング#Python#BigQuery#レコメンデーション#マッチング#因果推論
80,BU3086223,32,男性,東京都,1000,1250,大学院卒（MBA）,一橋大学,商学研究科MBAコース ,2013年3月,基礎会話レベル,8,データ分析スキル#コンサルティングスキル#人事関連スキル（採用、育成、配置）
81,BU2434790,29,男性,大阪府,500,500,大学院卒（修士）,大阪府立大学大学院,理学系研究科物理科学専攻 ,2019年3月,なし,2,Python（Tensorflowを好みます）#SQL（MySQL）#PHP・cakePHP#AWS#機械学習/Deep Learning#データ分析
82,BU1644527,32,男性,東京都,500,500,大学院卒（修士）,東北大学,理学研究科 ,2015年3月,基礎会話レベル,1,データ処理
83,BU2813059,32,男性,東京都,1000,1250,大学院卒（修士）,京都大学,人間環境学研究科 ,,基礎会話レベル,0,統計解析#仮説検証#統計学#SAS#SQL#国際金融規制対応#個人情報漏洩対応#割賦販売法改正対応#RAFの策定#レピュテーショナルリスク管理#オペレーショナルリスク管理#DataRobot#python#機械学習を用いた不正検知モデルの開発#分析用データマートの設計#機械学習モデル構築#データ解析系プログラミング#数理アルゴリズム#統計解析モデル#機械学習アルゴリズム
84,BU3474067,32,男性,埼玉県,750,1000,大学卒,武蔵大学,経済 ,,なし,4,tableau#qgis#R#python#bigquery#postgres#mysql#レポーティング#データクレンジング#機械学習#web分析#Google Analytics#VBA#データベース設計#顧客分析#クラスタリング#Excel#PowerPoint
85,BU4384468,26,男性,東京都,500,500,大学院卒（修士）,東京工業大学,環境・社会理工学院 ,2019年4月,ビジネス会話レベル,1,電気通信#MATLAB（基本レベル）#Python（基本レベル）#Power BI（基本レベル）#SQL（基本レベル）
86,BU4510593,29,男性,茨城県,600,750,大学院卒（修士）,滋賀大学,データサイエンス研究科 ,2021年3月,日常会話レベル,2,機械学習#統計モデリング#因果推論#R#データコンサルティング#多変量解析
87,BU4184876,29,男性,埼玉県,500,600,大学院卒（博士）,東京大学,新領域創成科学研究科 社会文化環境学,2021年9月,ビジネス会話レベル,1,データ処理#Python#Deep Learning
88,BU1298394,41,男性,東京都,1000,1250,大学卒,芝浦工業大学,システム工学部 電子情報システム学科,,日常会話レベル,7,データ分析#機械学習#業務効率化
89,BU2992846,29,男性,神奈川県,1000,1250,大学院卒（修士）,大阪大学大学院,システム創成専攻 ,2018年3月,基礎会話レベル,5,データ分析#統計解析#多変量解析#因果推論#時系列解析#機械学習#R#Julia#Python
90,BU0166537,39,女性,東京都,1000,1250,大学院卒（修士）,東京大学大学院,理学系研究科 物理化学専攻,2008年3月,ビジネス会話レベル,1,"Solution Architectとして各種クラウド/オンプレサービス間のインテグレーションの経験#Treasure DataのSalesからインプリまでを実行した経験#データサイエンスを実業で活用するためのビジネスコンサルティング能力#C、javascript、R、python、SQLなどに堪能#PMとしてのプロジェクト推進経験/能力#グローバルに働いた経験と英語能力#arduino, mbedなどエッジコンピューティングの経験とエバンジェリストとしての推進能力#顧客企業に深く入り込みインプリを推進する能力"
91,BU3472094,30,女性,東京都,500,500,大学院卒（修士）,筑波大学,システム情報工学研究科 ,,ビジネス会話レベル,1,データ処理#機械学習#Python
92,BU2777228,36,男性,東京都,1250,1500,大学卒,東京都立大学,理学部物理学科 ,,基礎会話レベル,5,データサイエンス#機械学習#統計学#データ処理#画像処理#深層学習
93,BU4305420,28,男性,東京都,600,750,大学院卒（修士）,慶應義塾大学, ,2020年3月,日常会話レベル,2,データ処理
94,BU4158139,30,男性,埼玉県,600,750,大学院卒（修士）,筑波大学,システム情報工学研究科 ,,日常会話レベル,6,(ベイズ)統計学#(ベイズ)統計モデリング#機械学習#論文実装
95,BU2775200,27,女性,東京都,500,600,大学卒,慶應義塾大学,総合政策学部 ,2018年3月,ビジネス会話レベル,2,コンサルティング#データサイエンス#Youtuber
96,BU3241189,27,男性,東京都,600,750,大学院卒（修士）,筑波大学,システム情報工学研究科 ,2019年3月,日常会話レベル,2,"AWS: Athena, EC2, S3, Lambda, Glue, CodeCommit#GCP: BigQuery, CloudFunction, GCE#分析スキル: 行動ログ解析、テキストデータ解析、統計的検定、ファネル分析、予測モデル作成#分析PJ推進: ビジネス課題整理、分析プロセス設計・遂行、結果報告、解決策提案・推進#アンケート企画推進: 企画書作成、調査票設計、画面実装(SurveyMonkey)、集計、報告書作成#集計依頼への窓口対応: 重要度・納期・精度の整理、それを踏まえた集計項目の調整・交渉#分析基盤整備: アクションログ設計、データマート作成、集計システム運用保守#SQL: 複数テーブルにまたがるデータ抽出、コストを意識したコーディング、各種集計(分析関数、Window関数)#Python: データクレンジング、各種アドホックな分析、モデル作成・性能評価・実装・デプロイ#Docker: 分析環境構築、既存環境の運用保守#git: チーム開発経験(pull/push, branch/mergeなど)#GAS: spreadsheet各種処理の自動化、slack連携、メール通知"
97,BU2046976,33,女性,東京都,500,600,大学院卒（修士）,東京工業大学,社会理工学研究科社会工学専攻 ,2014年10月,ビジネス会話レベル,6,"R, Pythonを用いたデータ分析、機械学習#SQL, Hadoop, Hive, Spark, TresureData, Google BigQueryを用いた大規模データ集計#顧客へのデータコンサルティング#レコメンドシステム開発#検索システム開発（Elasticsearch, Fluentd）#広告KPI分析#Webアクセス解析（Google Analytics）#BIツール取扱（Tableau, Looker）#Kaggle#英語（英検1級、TOEIC965点）"
98,BU3083418,29,男性,埼玉県,500,500,大学院卒（修士）,会津大学, ,2018年3月,基礎会話レベル,2,C/C++#SQL#NLP#機械学習(時系列モデル)#Pyspark#データ分析#コンサルティング業務#Python#パワーポイント#エクセル#ワード#統計学
99,BU1811449,34,男性,東京都,750,1000,大学卒,九州工業大学,物質工学科 ,2012年3月,日常会話レベル,2,予測分析#機械学習#多変量解析#Python#Git#Docker#SQL Server#Azure#Tableau#プロセスマイニング#Celonis#事業戦略・事業計画の策定#ビジネスアナリスト#データサイエンティスト
